{
  "accepted_claim": "Everything important should be measured.",
  "extreme_extension": "Every gesture of care, apology, grief, and affection receives a daily score that must be maintained.",
  "absurd_outcome": "Couples exchange monthly intimacy compliance reports and appeal low empathy scores through a relationship analytics portal.",
  "revealed_problem": "The original measurement logic turns qualitative trust into administrative performance.",
  "critical_artifact_or_task": "A printable intimacy score correction form with evidence upload fields.",
  "hidden_dependencies": ["emotion classification standards", "relationship data brokers", "appeal moderators"],
  "critical_discussion": ["What becomes unrecognizable when care must be measurable?", "Who profits from making intimacy auditable?"],
  "absurd_artifact_brief": "A stark bureaucratic relationship metrics form with empty scoring circles, evidence fields, and appeal instructions.",
  "process_or_system_visual_prompt": "A black-and-white workflow diagram of intimacy scoring, dispute review, and score correction.",
  "semantic_summary": "A reductio scenario that exposes over-quantification by pushing emotional measurement to an absurd administrative endpoint."
}
